,Python and PostgreSQL a Wonderful Wedding,09-20-2015,10:00,10:30,Osper Room (CC1.4),,"Stephane Wirtel

Python and PostgreSQL, two tools we like to use for our projects but do you know everything about them?

The talk will give an overview of psycopg2, Peewee, SQLAlchemy, Alembic and multicorn, PL/Python, these libraries can be used with PostgreSQL.

- psycopg2, the well known connector, this basic component is really useful, well documented and battle-tested and used by the most famous toolkits of the Python ecosystem.
- Peewee, a minimalist ORM for Python, clear and brief, this ORM can be used if you want create a software with a minimalist ORM.
- SQLAlchemy, a Python SQL toolkit and Object Relational Mapper, you can use this library to create your models and interact with them.
- Alembic, a lightweight database migration tool for usage with SQLAlchemy, allows to create some migration scripts for your project.
- multicorn is a Python wrapper over the Foreign Data Wrapper of PostgreSQL
- PL/Python, a procedural language for PostgreSQL, allows to write functions in the Python language.

You can find this talk on  https://speakerdeck.com/matrixise/python-and-postgresql-a-wonderful-wedding-english"
,Building Async MicroServices,09-20-2015,10:00,12:30,YPlan Room (CC1.8),,"Norberto Leite

Over the course of the 2.5 hours of this workshop you will learn how to leverage both Python and MongoDB to build highly scalable, asynchronous applications based on micro services architecture. We will be building from scratch several different ""exotic"" services, using a variety of datasets, that together we can mashup into a consolidated application using our own laptops. 

We will start by introducing several  technologies that we will be using (e.g. Python, Tornado, MongoDB, AngularJS) and take a ten-thousand foot  overview of micro services architecture.
In the second half of the workshop, we will break into teams that will each take charge in implementing a micro services that will comprise our final application. 

This a fully hands-on workshop.

Learning objectives: 
Benefits of micro service architectures
MongoDB schema design 
MongoDB query optimization and profiling 
Basic understanding of AngularJS 
Flask as REST API platform

Target Audience:
This workshop is recommended to software developers eager to understand more about MongoDB and how to build async calls. Coding skills and basic understanding of Python is required. Prior experience with AngularJS and Tornado is welcomed.

Technical Requirement:
The attendee should bring their own laptop with MongoDB and Python (>2.7) installed. One should have administration grants over their system because we will need to expose ports and other communications to the network. The datasets and project instructions will be provided on site."
,Open Space,09-20-2015,10:00,10:30,LaterPay Learning Space (Bistro),,
,"Tit for Tat, Evolution, Game Theory and the Python Axelrod Library",09-20-2015,10:00,10:30,The Software Sustainability Institute Room (CC2.1),,"Vince Knight

This talk will begin with the origin of species. More precisely with a discussion of Darwin's theory of evolution and how Game Theory has been used to explain/illustrate aspects of cooperation in complex dynamics.

In 1980, professor Robert Axelrod created a computer tournament inviting submissions of code snippets that would compete against each other. A large amount of academic study has concentrated on the outcomes of this experiment. The particularity of the outcome, was that even when the tournament was repeated with a much larger number of strategies, a very simple strategy was victorious: Tit for Tat. This strategy tries it's best to cooperate with other strategies!

The talk will briefly discuss all of this but will concentrate on a new Python library (`pip install axelrod`). This project, hosted on github allows anyone to recreate the tournament but also (and arguably more importantly) submit strategies via pull request!

It is anticipated that this talk would be appreciated by coders of all levels as it gives a very low entry level for a contribution to an open source project. It should also be of interest to the more experienced coders as it is hoped that novel strategies will be devised and submitted. Indeed, historically strategies have been mainly devised by mathematicians and economists, surely the pyconuk attendees will bring something new to the repository?

Finally, for those who are perhaps not interested in 'playing along' the talk will also describe the newest addition to the project which is a Django project aiming to bring this study of evolution to a popular audience."
,Here be Dragons - Writing Safe C Extensions,09-20-2015,10:30,11:00,PythonAnywhere Room (CC1.3),,"Paul Ross

Writing Python C Extensions can be daunting; you have to embrace not just C but Python's C API, which is huge. Not only do you have to worry about just your standard malloc() and free() but now you also have to contend with how CPython manages its memory.

This talk describes what you need to know to write fast ,reliable Python extensions in 'C'. It demonstrates some of the pitfalls you can encounter and some simple and robust coding patterns that you can use to avoid them. After this talk you will be able to write Python extensions with confidence.

This talk is largely based on [this material][1] and some hard won industrial experience.

  [1]: https://github.com/paulross/PythonExtensionPatterns"
,Python powered Nukes,09-20-2015,10:30,11:00,Osper Room (CC1.4),,"Babak Khataee and Dan Milburn

NukeStudio is a digital compositing tool used throughout the visual effects industry. Our talk will try to cover how our Python bindings let users use NukeStudio as an environment for making their own tools for video processing and compositing. This will involve going through a couple of examples before going onto discussing the structure/design of the bindings and how they also enable us to use NukeStudio in other contexts."
,Open Space,09-20-2015,10:30,11:00,LaterPay Learning Space (Bistro),,
,Ship Data Science Products!,09-20-2015,10:30,11:00,The Software Sustainability Institute Room (CC2.1),,"Ian Ozsvald

Building and shipping working Data Science and scientific products is hard - learn from 10 years of Ian's experience at ModelInsight.io to find efficient ways through the mess of bad data, complicated data workflows and weakly designed code through to successfully deployed projects. 

This talk will include ways of getting data, cleaning and debugging it, approaches to deployment and various tips I've picked up along the way that'll save you lots of time.  

If you're fresh out of academia and want to do science then this will open your eyes to how 'stuff works in industry'. If you're in a growing data science team and you want to do more science and spend less time fighting fires - this talk is definitely for you. Be more effective, stop fighting fires and burning time.

Ian Ozsvald is co-founder of the 1,500+ member PyDataLondon meetup and conference series, a published O'Reilly author, international speaker and teacher and he runs a 10 year old Data Science consulting group in London (ModelInsight.io)."
,How (not) to argue - a recipe for more productive tech conversations,09-20-2015,11:00,11:30,PythonAnywhere Room (CC1.3),,"Harry Percival

If you've spent any time in technology, you will have come across the classic phenomenon of the unproductive technical debate -- and not just bikeshedding.  Much of our technical debate seems to end up full of cognitive dissonance, ego, the cherry-picking of evidence, talking at cross purposes, and argument for its own sake.

This talk will attempt to diagnose the roots of this disfunction, and provide some pointers towards how to engage in more constructive dialogue.

Keywords:  Torvalds, Socrates, Jonathan Haidt,  Djangogirls, Cognitive Behavioural Therapy."
,Testing applications for django CMS,09-20-2015,11:00,11:30,Osper Room (CC1.4),,"Iacopo Spalletti

Testing applications integrated with django CMS can be complex with a lot of boilerplate code and some dark corners
This talk will try to make it clearer and easier to write tests and will present tools to reduce the effort and the boilerplate"
,Open Space,09-20-2015,11:00,11:30,LaterPay Learning Space (Bistro),,
,iCE: Interactive cloud experimentation,09-20-2015,11:00,11:30,The Software Sustainability Institute Room (CC2.1),,"George Lestaris

In the cloud-computing era, many technologies like Puppet, chef, ansible, etc arose to take care of setting up, maintaining and provisioning virtual machine clusters. However these tools do not prove to be practical for cases where the user wants to test a deployment or try a small experiment involving many VMs in the cloud. Additionally they lack interactiveness and the user is unable to hijack or influence the deployment process during runtime. Python iCE is a tool that aims to enable interactive cloud experimentation. It can deploy VM clusters in EC2-compatible public clouds and allow the user to manage them through SSH. It formalises an experiment as a Python script with fabric tasks which can run on every or selected VMs in a cluster. It also integrates with IPython and it has its own shell that allows for interactive handling of the VMs. iCE is built with well-established Python libraries like IPython, boto and fabric.

iCE comes with a lightweight agent that registers a VM to an experiment’s pool. This agent will run automatically for VMs deployed with iCE but users can manually run it on already running VMs to utilise them through iCE. Its IPython shell facilitates the development and execution of experiments. Its main goal is to bring the ease of use and interactiveness of single-machine SSH sessions to virtual clusters."
,FIDO - The dog ate my password,09-20-2015,11:30,12:00,PythonAnywhere Room (CC1.3),,"Alex Willmer

Passwords are a pain for us all - programmers, users and admins alike. How can we reduce that pain, or eliminate it entirely?

This talk will 

 - Introduce [Universal Authentication Framework (UAF) & Universal Second Factor (U2F)][specs]
 - Describe how they streamline authentication, even eliminate passwords entirely
 - Show how to integrate UAF/U2F into a Django web application
 - Summarize the state of support for UAF & U2F in browsers, devices, and the wider world

As an audience member you will

 - Learn how to implement seamless authentication
 - Gain a sense of hope, that you never have type `EH3EX?e)8>6%sZ)48B^l3o08R` again

This talk is a condensed version of [Taking the pain out of passwords and authentication][eptalk], first presented at EuroPython 2015.

[eptalk]: https://ep2015.europython.eu/conference/talks/taking-the-pain-out-of-passwords-and-authentication
[specs]: https://fidoalliance.org/specifications/overview/"
,The Ladder to Python 3,09-20-2015,11:30,12:00,Osper Room (CC1.4),,"Daniel Pope

> ""Python 3.0 final was released on December 3rd, 2008.""
>
> - Python 3.0 Release notes

> ""The End Of Life date (EOL, sunset date) for Python 2.7 has been moved [...]
> to 2020.""
>
> - PEP 373: Python 2.7 Release Schedule

Migrating to Python 3 is not a big bang, it's a sequence of steps, like the
rungs of a ladder that spans from 2008 to 2020.

In 2015, many people still start new projects in Python 2. Many of us are
shackled to Python 2 for work. Some of us don't even have a migration plan.
Many people at this conference, if asked to run ""Python"", will launch Python 2.

Daniel will encourage you to grasp the ladder, put your feet firmly on it, and
take the next step in climbing to Python 3."
,Open Space,09-20-2015,11:30,12:00,LaterPay Learning Space (Bistro),,
,Power: Python in Astronomy,09-20-2015,11:30,12:00,The Software Sustainability Institute Room (CC2.1),,"Tomas James

The universe is a wild and wonderful place. From the quantum mechanical effects that power the Sun, to the gravitational effects that suck everything in to a black hole, one thing links them all: they can all be analysed using Python.

Python’s clear syntax and extensibility makes it an incredibly usable and streamlined language for scientists. We’ll cover off exactly how scientists use Python, what Python can do that other languages can’t (and where it sometimes falls short), and just how Python can be used at home to generate beautiful astronomical images."
,PyCon UK Jobs Fair,09-20-2015,12:00,14:00,PythonAnywhere Room (CC1.3),,
,Single Board Computer HackSpace,09-20-2015,12:00,13:00,Osper Room (CC1.4),,
,Open Space,09-20-2015,12:00,12:30,LaterPay Learning Space (Bistro),,
,Pythons and Earthquakes,09-20-2015,12:00,12:30,The Software Sustainability Institute Room (CC2.1),,"Girish Kumar

This is a session we will cover how python is used in providing near-real-time maps of landslide hazard following large earthquakes. And to dig detail on tool we build called 'shakeslide' for post-distaster response, analysis and research. 

By end of this session my audience will be enriched by the potential of python programming language and its contribution in the solving some of the serious issues in today's world, in field of research. I will also discuss the process of  how research paper was converted into functional web application and its impact of doing that. Hopefully, this talk should motivate PhD students and research staff in using python for their projects and helps them to realise their potential impact they could make in their research application."
,Event-Sourced Domain Models in Python,09-20-2015,12:30,15:00,YPlan Room (CC1.8),,"Robert Smallshire

#### Preparation

 * This is a *work*shop, not a lecture, so come with a laptop or pair-up with
 somebody who has one.

 * This workshop requires at least [Python 3.4](https://www.python.org/downloads/) so you should have a suitable interpreter installed.

 * Bring your favourite Python code editor.

 * Have the [workshop student materials](https://bitbucket.org/sixty-north/d5-workshop-exercises-student-material) installed from Bitbucket. Further instructions are to be found there.

#### Synopsis

In first part of this workshop we explore how to implement rich domain models using plain-old Python objects which are completely independent of any particular persistence technology such as an object-relational mapper.  Domain models often embody the core value of software systems, so implementing models independently of - often ephemeral - technology choices is an important strategy for long-lived, high-value systems.

In the second part of this workshop we implement an event-sourced architecture for persistence of our domain model, whereby all changes applied to the model are recorded as events in a simple, append-only event-store.  From this event store we can reconstitute the model state as it was at any historical time, something that is difficult – if not impossible – to do with most object-relational solutions.  Furthermore, we can project the event stream into other representations to support queries which are not conveniently supported by the entities in our model, or which roll-up historical data. Among many other benefits, such projected read-models gives very high scalability on the read-side.

This workshop is aimed at Python developers who want to step beyond the limits of canned framework-based solutions such as Django models, or toolkits such as SQLAlchemy, (which are ultimately about managing the horrors of shared-mutable state).  Event-sourced domain models facilitate allow us to combine the best aspects of object-oriented design with robust and simple persistence inspired by functional-programming practice."
,Open Space,09-20-2015,12:30,13:00,LaterPay Learning Space (Bistro),,
,Lunch,09-20-2015,12:30,13:30,The Software Sustainability Institute Room (CC2.1),,
,Lunchtime Event Spare Slot,09-20-2015,13:00,14:00,Osper Room (CC1.4),,
,Open Space,09-20-2015,13:00,13:30,LaterPay Learning Space (Bistro),,
,Open Space,09-20-2015,13:30,14:00,LaterPay Learning Space (Bistro),,
,Getting meaning from scientific articles,09-20-2015,13:30,14:00,The Software Sustainability Institute Room (CC2.1),,"Eleonore Mayola

The bibliography process means every scientist regularly has to go through a lot of published articles in parallel to her/his research. The aim is 1) to know what other researchers are doing: they might be ahead of you, they might have proven your project is a dead end, 2) get some context to interpret your research results. 
Using specialised search engines can be inefficient if you don't use the ""right"" keywords. Researcher also tend to find bibliography boring so it would be interesting to automate part of the process!

In my talk I'll answer the following question: can Python machine learning libraries (nltk, scikit-learn) be used to 
determine whether a research article is worth reading? I'll use the Natural Language Processing to identify articles topics and train a classifier to distinguish between relevant and non-relevant articles depending and someone's area of research."
,"Python and the terminal - Input, Output, Pipes and Snakes",09-20-2015,14:00,14:30,PythonAnywhere Room (CC1.3),,"Tom Viner

The first half will look at how Python interacts with keyboard and command line *input*
- Reading standard input and command line arguments
- The built-in fileinput module: ""Iterate over lines from multiple input streams"", from pipe or via filename like GNU utils `cat` or `diff` do
- Reading keys in non-blocking mode: ascii one-d snake!

Then we'll look at the powers of Python in printing *output* to the screen
- Terminal colours
- The legacy of teleprinter output: overcoming the printed page metaphor
- Control characters: magic manipulation of the console

And we'll see various library modules that can help us along the way."
,Getting schemas around semi-structured data using Avro,09-20-2015,14:00,14:30,Osper Room (CC1.4),,"Konark Modi

In this world of big-data where we are producing data of enormous variety, velocity, volume and the nature being semi-structured we need to put some rules around data being collected which are not rigid yet allow efficient management of it right from collection layer.

My talk is based on first-hand experience that me and my team had while writing frameworks and data pipelines , we like anyone else started with collecting data in JSON format. But soon started to run into problems because of systems which were writing the data were abusing the flexibility.

More importantly how we can leverage Python with this and makes it interoperable with various Big Data techologies.

Schemas  / Serialization is a layer not many people talk about , but in my experience it is very useful and one can benefit from it in many many ways.


The agenda of the talk is as follows :

1. Need of a schema / serialization.
2. Avro and why is it so awesome.
3. Demo of creating some schemas and showcasing the features.
4. How Avro serialized data can be used across different layers / tools in the BigData pipeline. Be it Realtime processing system like Kafka with Storm or Batch processing system like Hadoop, Hive etc.
5. Setting up your AVRO schema repository to help people create, distrubute and manage schemas. A pure Django based implementation.
6.  Do's and Don'ts .


Who should Attend :

I plan to keep it beginner friendly, any one who has been or is doing data collection at any level can benefit from this talk."
,Open Space,09-20-2015,14:00,15:00,LaterPay Learning Space (Bistro),,
,Demo: Simple web services for scientific data,09-20-2015,14:00,14:30,The Software Sustainability Institute Room (CC2.1),,"Alys Brett, Culham Centre for Fusion Energy

Would you like to let people access your data over the web or generate plots on
the fly when someone loads a web page? This session will introduce the benefits
of creating web services for accessing scientific data and let you try out the
basics for yourself.

It is now common for online companies to provide programmatic access to data -
web APIs where data resources in many forms can be accessed via a URL. This
approach can be very useful for scientific data too. One benefit is that you
don't have to worry about what platforms and languages to support - the data can
be used by anything that can make HTTP requests. You might think that creating
this kind of web service is solely the preserve of professional engineers but,
with the power of Python, this is changing. There are very convenient packages
(such as Flask and Requests) that make it incredibly simple to get started.

The session will start with a demonstration of some web services we've developed
for nuclear fusion data from the JET experiment, including a plot server and a
data browsing tool. This will be followed by a mini-tutorial to help you get
started with harnessing the power of HTTP web services."
,Data Visualisation with Python and Javascript - crafting a data-visualisation for the web,09-20-2015,14:30,15:00,PythonAnywhere Room (CC1.3),,"Kyran Dale

To accompany an upcoming O'Reilly book 'Data-visualisation with Python and Javascript: crafting a dataviz toolchain for the web' (see here) this talk aims to sketch out the toolchain by transforming some dry Wikipedia data (Nobel prize-winners) into a far more engaging and insightful web-visualisation. This transformative cycle uses Python big-hitters such as Scrapy, Pandas and Flask, the latter delivering data to Javascript's D3. These are the industrial lathes of the toolchain but Python's fantastic standard library and all those first class data-munging libraries are involved, the spanners, hammers and screwdrivers of the toolchain.

While Python is fast becoming the goto language for data-processing/science, the visual fruits of that labour hit the wall of the web, where there is only one first-class language, Javascript. To develop a data-viz toolchain for the modern world, where web-presentation is increasingly mandated, making Python and Javascript play nicely is fundamental. This talk aims to show that the perceived wall between the two languages is actually a thin, permeable membrane and that, with a bare minimum of web-dev, one can get on with programming seamlessly in both."
,Analyse Yourselves,09-20-2015,14:30,15:00,Osper Room (CC1.4),,"Norberto Leite

Abstract: In today's mundane usage of digital services, from ecommerce to day-to-day email, one might imagine that we generate a considerable amount of data. We access the internet, our phones are constantly generating information and sharing that with services, sometimes without us being total aware of such, and even our household appliances are starting to become more and more self sufficient and connected, the so called internet of things or internet of everything. Can we start getting in control of that data? What tools do we have available to start getting a sense of what's the size/shape/kind of data that we generate? Where does it come from and where do we send it to?
Although the talk title might suggestion topics around introspection and psychoanalysis we are not going to get into that (not in psychological ground at least) but we will look into in which ways could we build small sets of applications that could give us a better sense of our digital footprint and content that flows at our broadband connection. We will be analysing samples of email, internet traffic, webapps and mobile apps data connections and inflows.

Learning objectives:
Use simple python libraries we will be looking into what we can do tap on our devices and keep track of our digital inflows like scapy and httplib2
Tools available to analyse and store and this data, mostly around pandas and mongodb
Libraries to present and visualize this information like seaborn and matplotlib
Tools for predictive analytics like anaconda. 

This is practical session where we will be discussing some of these general aspects of the data crossing ""our pipes"" and what we can do with that to learn a bit more of ourselves or which type of interactions do we do in a quantifiable manner.

We will be using quantifiable and measurable traffic from several different feeds including your facebook timeline, twitter feeds, email and internet traffic."
,Discussion: From data to dissemination - dealing with publications,09-20-2015,14:30,15:15,The Software Sustainability Institute Room (CC2.1),,"Discussion: From data to dissemination: dealing with publications

A major theme for anyone in working research is how best to publish and
disseminate their work. These days a wide range of tools are available to help,
at every stage of the writing process - from great Python libraries for
charting, to online bibliography tool and LaTeX packages to beautify your
papers. This panel discussion will cover all aspects of dissemination work,
and how Python can ease your publication pain.

Panel members will be announced nearer the time of the conference."
,Plenary,09-20-2015,15:00,15:15,PythonAnywhere Room (CC1.3),,
,The PyCon UK Panel,09-20-2015,15:15,16:00,PythonAnywhere Room (CC1.3),,
,The Lightning Talk Show,09-20-2015,16:00,17:30,PythonAnywhere Room (CC1.3),,
,The Non-Closing Closing,09-20-2015,17:30,18:00,PythonAnywhere Room (CC1.3),,
,End of Day,09-20-2015,18:00,19:30,PythonAnywhere Room (CC1.3),,
,The Mellow Night,09-20-2015,19:30,23:59,PythonAnywhere Room (CC1.3),,
,Sprint Opening,09-21-2015,09:30,10:00,Sprint Rooms,,
,"Sprints are collaborative programming groups. The Sprints that have been proposed so far are: Python for Science sprint Don't be afraid to commit Unit test documentation improvements Axelrod - sprint/tournament - code up strategies, get famous Improving the Myrmidon Python game framework py.test sprint Romaine (BDD tool) MicroPython / BBC micro:bit Pylint sprint Pi In The Sky",09-21-2015,10:00,12:30,Sprint Rooms,,
