,Building SAAs with django and polla,09-19-2015,10:00,10:30,Osper Room (CC1.4),,"Emmanuelle Delescolle

Airavata is a tool to help run multiple websites under Django using the same codebase and the same database.
This talk will demonstrate how to build a SAAS service with those tools.

In the meantime you can already checkout [the project's page](https://bitbucket.org/levit_scs/airavata)."
,Fifty Shades of Disaster - Human Error and Complex Systems,09-19-2015,10:00,13:00,YPlan Room (CC1.8),,"Paul Ross

A four part workshop that discusses the failures that happen when humans interact with complex systems. The talks illustrate what can be learnt from how various industries handle risk management. They are illustrated with analysis of some famous and not so famous accidents from finance, aviation, marine, software, oil and various other industries.

You are not going to live long enough to make all the mistakes yourself so its best to learn from those made by others. After this workshop you will be more resilient to failure!

Part 1: Complexity, coupling and systems failure
  - A gentle introduction to human error and modern accident theory

Part 2: A concise history of civil aviation accidents
  - How air travel became so safe

Part 3: Blame and the fallacy of Root Cause Analysis
  - How not to investigate an accident

Part 4: Heroic recoveries, skill, luck and sheer professionalism
  - The disasters that never happened"
,Open Space for BoFs and discussion,09-19-2015,10:00,10:30,LaterPay Learning Space (Bistro),,
,Forming a PyCon UK research community,09-19-2015,10:00,10:30,The Software Sustainability Institute Room (CC2.1),,"Sarah Mount, University of Wolverhampton

Sarah opens the Science Track by introducing the workshops, talks and
sprint and discusses the formation of a research community."
,Group Activities: Minecraft Code Club Your code in space Internet of Toys,09-19-2015,10:00,11:15,Bank of America Education Track (Simulation Centre),,
,Managing mocks - the how why and when of mocking in Python,09-19-2015,10:30,11:00,PythonAnywhere Room (CC1.3),,"Helen Sherwood-Taylor

Mocking is a valuable technique for writing tests, but is it always a good idea?

I want to give a brief introduction to the how and why of mocking and the scope of its usefulness - I'll look at situations where it is provides the most benefit and the times when it can be taken too far. 

Python is packaged with an excellent mocking module but we'll also look at some other libraries which can help with mocking effectively."
,Template matching - howto,09-19-2015,10:30,11:00,Osper Room (CC1.4),,
,Open Space,09-19-2015,10:30,11:00,LaterPay Learning Space (Bistro),,
,Accelerating Scientific Code with Numba,09-19-2015,10:30,12:30,The Software Sustainability Institute Room (CC2.1),,"Graham Markall

This tutorial will provide an overview of Numba, a just-in-time Python compiler focused on numerical computing. Originally aimed at computations using Numpy arrays, it has been expanded to work with other Python types and can speed up computations that require more than just fast linear algebra operations. Numba targets both CPUs and CUDA GPUs by generating native code using the LLVM compiler infrastructure.

This introduction aims to span the breadth of use cases rather than focusing on a single area in depth. This is in order to enable the selection of appropriate portions of code to use with Numba, and the correct selection of Numba's facilities in each case.

Areas that will be covered include:

* An overview of the type system, with a view to understanding and overcoming typing issues,
* Compilation of Python functions using the @jit decorator,
* Creation of Numpy ufuncs in Python using the @vectorize decorator,
* Understanding the performance of compiled code, and performance optimisation tips,
* Debugging facilities in Numba.

This tutorial is intended for an audience of programmers and data scientists who have an interest in speeding up numerical routines, and people with a general interest in high-performance Python. In order to get started quickly, it is recommended that attendees install the Anaconda Python distribution or Miniconda, as this provides a robust mechanism for installing Numba on Linux, Mac OS X and Windows."
,5 impossible things before breakfast,09-19-2015,11:00,11:30,PythonAnywhere Room (CC1.3),,"Michael Sparks

Sometimes you're asked to deliver something that seems impossible, but
necessary in a given timeframe.  Sometimes it's several seemingly impossible
things.

Developing the prototype for the BBC Micro:bit - a pocket sized, child
programmable computer - was very much like this.  It had 3 months to be
delivered in a form sufficiently robust and usable to be used by children in
schools across the country; to be sufficiently documented to be completely
understood from scratch by others; and to be a sufficiently open and
flexible design to allow any and all parts of the system to change, while
retaining its core principles.

There was about 3 months to develop the entire stack from scratch. This
included a microcontroller based hardware stack, through firmware, a python
to C++ compiler (3-4 weeks), through django website, through to a QT
(PySide) client side application, through to publication of the device as a
network connected and controllable device via REST.  Python was involved in
all layers - including at microcontroller level on a device too small to run
any python interpreter.

The bulk of the development period had just one developer for hardware
and software.  For just 1 month there were 2 extra developers brought on
board, part time to assist.

This talk will be a detailed overview of the various subsystems, and the
strategies taken to deliver a complete, mass produce-able, and sufficiently
scalable product such an aggressive timescale.  The talk title is a nod to
the idea that while each of the various layers is doable alone in 3 months,
doing all the layers simultaneously using one developer is ... challenging.

It should be of interest to those interested in developing hardware and
software products, and especially those developing products that have both a
hardware and software element."
,"Asking About Gender - the Whats, Whys and Hows",09-19-2015,11:00,11:30,Osper Room (CC1.4),,"Claire Gowler

As we move towards more customised experiences for our users, why do we still insist of using the black boxes of male and female when asking users about their gender? And why are we asking for it in the first place?

Between 1 and 5 percent of the UK population identifies as having a non-binary gender or are transgender. This talk aims to help developers ask users about their gender in a useful and sensitive manner; educate on what non-binary means and what other issues non-binary and gender variant users may face when using the web."
,Setup for Poster Session,09-19-2015,11:00,12:00,LaterPay Learning Space (Bistro),,
,Everyone Swap: Minecraft Code Club Your code in space Internet of Toys,09-19-2015,11:15,12:30,Bank of America Education Track (Simulation Centre),,
,Finding more bugs with less work,09-19-2015,11:30,12:00,PythonAnywhere Room (CC1.3),,"David R. MacIver

Mainstream software testing is terrible, because the tools to make it good are missing. [Hypothesis](http://hypothesis.readthedocs.org/en/latest/) is a testing library that aims to fix this.

Where classically unit testing requires you to think of all the edge cases yourself, Hypothesis actively seeks them out for you. Instead of laboriously setting up examples where your code should work, you tell it how your code should always work and it finds the examples that prove you wrong.

This is a talk from the author of Hypothesis on the how, why and where of using it.

This talk presupposes you have at least a little bit of experience with testing in Python, but familiarity with advanced topics is not required."
,"Why I have an unhealthy love of tests, and why you shouldn't be scared about writing them",09-19-2015,11:30,12:00,Osper Room (CC1.4),,"Gemma Hentsch

Tests, I used to hate them, and actually when I start writing tests on a new project I still do.

But, you don't have to be scared about them, and I'd like to cover developing your testing strategy, what to test, what not to test, and how to explain how to convince higher ups that its not just a useful spending of time, its a vital part of your job."
,Lunch Events Spare Slots,09-19-2015,12:00,14:00,PythonAnywhere Room (CC1.3),,
,Recruitment Clinic,09-19-2015,12:00,14:00,Osper Room (CC1.4),,
,Poster Session,09-19-2015,12:00,14:00,LaterPay Learning Space (Bistro),,
,Py4Sci Lunch,09-19-2015,12:30,13:00,The Software Sustainability Institute Room (CC2.1),,
,"PyKids UK Lunch (provided packed lunch including sandwich, fruit and crisps)",09-19-2015,12:30,13:00,Bank of America Education Track (Simulation Centre),,
,Scrapy Workshop Part 1,09-19-2015,13:00,15:00,YPlan Room (CC1.8),,"Juan Riaza

If you want to get data from the web, and there are no APIs available, then you need to use web scraping! Scrapy is the most effective and popular choice for web scraping and is used in many areas such as data science, journalism, business intelligence, web development, etc.

This workshop will provide an overview of Scrapy, starting from the fundamentals and working through each new topic with hands-on examples.

Participants will come away with a good understanding of Scrapy, the principles behind its design, and how to apply the best practices encouraged by Scrapy to any scraping task.

Goals:

- Set up a python environment.
- Learn basic concepts of the Scrapy framework."
,Getting started with testing scientific programs part 1,09-19-2015,13:00,15:00,The Software Sustainability Institute Room (CC2.1),,"Martin Jones

When writing programs for scientific research, we tend to be focussed on getting results, so testing is generally not a priority. Often, this means that our data-processing pipelines end up incorporating programs that don't have test suites. Examples of high-profile retractions due to software errors (e.g. http://www.sciencemag.org/content/314/5807/1856.full) illustrate the dangers of this approach. 

This session will be a gentle introduction to testing, aimed at people writing scientific software who would like to start taking advantage of automated testing. We'll start with Python’s built-in tools and moving on to using the Nose testing framework. We’ll look at the problems that testing can solve, and see some best-practises for writing tests.

####Goals

The goal of this training session is for attendees to come away with (1) an understanding of some basic testing concepts, (2) some hands-on experience of running tests and interpreting the output, and (3) an idea of how to start applying these tools to their own projects.

####Who should attend this session
Attendees should have a basic knowledge of Python and should be familiar with the idea of functions, conditions and exceptions. They should also have the Nose package installed (pip install nose should work in most cases).

####What to do before this session
If you plan to attend this workshop, you can make things run smoothly by making sure that you have the `nose` module installed. Follow [the instructions on the nose website](https://nose.readthedocs.org/en/latest/). You'll also need internet access in order to download the example files, so make sure you can connect to the conference wifi."
,Freestyle code jam,09-19-2015,13:00,15:00,Bank of America Education Track (Simulation Centre),,
,Taming a Legacy Codebase with (Micro)services,09-19-2015,14:00,14:30,PythonAnywhere Room (CC1.3),,"John Chandler

This is a story of killing-off a legacy codebase written in PHP. To the business, it ""just works"" and the customers love it. To the developers, it's an unmaintainable nightmare of bad practice that has resisted every attempt to rewrite from scratch.

From the ashes of those doomed rewrites came a more incremental approach, finding areas in the code that could be extracted into small, composable services.

I'll discuss why microservices are nothing new, how our approach evolved, the challenges of adoption, and the pros and cons of the approach. Although I won't delve too deeply into the technology stack, I'll doff my (metaphorical) hat to Django REST Framework and a few other tools of choice that have made the work possible.

I hope to cut through the microservices hype, and illustrate one way of using them to refactor, and ultimately replace, a legacy monolith."
,Language Composition with RPython,09-19-2015,14:00,14:30,Osper Room (CC1.4),,"Edd Barrett

Language composition allows us to write programs in a mixture of different languages. This sounds ideal since it should allow us to choose the best mix of languages for the task at hand. Due to technical hurdles however, language compositions tend to be little more than simple foreign function interfaces (FFIs).
                                                                                
At King's college London we are trying to build better language compositions. We have devised a new approach which makes it much easier to intermingle programming languages without compromising performance. In this talk I will outline our approach and show what happens when you put Python and PHP in a blender."
,Open Space,09-19-2015,14:00,15:00,LaterPay Learning Space (Bistro),,
,Title To Be Determined; A tale of graphs and Markov chains,09-19-2015,14:30,15:00,PythonAnywhere Room (CC1.3),,"Gary Martin

In the runup to PyconUK 2014, I made the following ill-advised statement in an IRC channel: ""I feel like I should find something to talk about at PyconUK. I wish I had something interesting to talk about."" Nine seconds later someone replied ""create a markov chain to generate a talk from the names of the talks at pycon and europython, then talk about how you did that, using a title it generates as the title of the talk.""

Challenge accepted. This is that talk, admittedly one year late.

In this talk I will briefly describe Markov Chains as a means to simulate conversations and graph databases as a means to store Markov Chains. After this, I will discuss various considerations for creating interesting candidate responses in conversations, along with the challenges of too little and too much data. Finally, I will demonstrate my implementation and generate the title of this talk."
,Shipping your application using Conda,09-19-2015,14:30,15:00,Osper Room (CC1.4),,"Floris Bruynooghe

Shipping your Python application to customers has always been an
interesting challenge.  Many Operating Systems ship with a Python
version, but they only ship that to support their applications and it
will probably miss dependencies you need or be the wrong version.  So
you need to build and ship your own Python environment, but one which
can work on all these different platforms.  This is never easy.

Recently Continiuum Analytics have released their Conda package
manager as open source, which is very well suited to address this
problem.  It has support for building and distributing binary packages
and is capable of creating a stand-alone environment for your
application with no or minimal dependencies on the host OS.  But even
starting from a good tool there are still a lot of tricks to building
a good Python distribution.  This talk will concentrate on UNIX
platforms and dive into the details of what needs to be done to create
a portable distribution.  It will then discuss how to fully bootstrap
such a distribution using Conda."
,Plenary,09-19-2015,15:00,15:30,PythonAnywhere Room (CC1.3),,
,Wrap up,09-19-2015,15:00,15:30,Bank of America Education Track (Simulation Centre),,
,Lightning PyKids UK,09-19-2015,15:30,16:00,PythonAnywhere Room (CC1.3),,
,PyCon UK Society AGM,09-19-2015,16:00,16:30,PythonAnywhere Room (CC1.3),,
,Teaching youngsters to code with pgzero on Raspberry Pi,09-19-2015,16:30,17:00,PythonAnywhere Room (CC1.3),,"Tim Golden

I've set up a short series of workshops to help a small group of 13-15-year-old boys to learn how to code with a small element of physical computing thrown in. This talk will describe the reasons for the setup and approach I used, and will discuss the outcomes: what worked; what didn't; and what I might do differently."
,OOD Rules,09-19-2015,16:30,17:00,Osper Room (CC1.4),,"Hamish Downer

We all want to keep our code comprehensible and easy to test, change, reuse and extend - it's easy(er) if you follow the OOD Rules.

This is based on my experience of trying to follow ""The Rules"" (of Object Orientated Design) by the wonderful Sandi Metz of the Ruby world. http://poodr.com/ and https://www.youtube.com/watch?v=npOGOmkxuio"
,Scrapy Workshop Part 2,09-19-2015,16:30,17:30,YPlan Room (CC1.8),,"Juan Riaza

If you want to get data from the web, and there are no APIs available, then you need to use web scraping! Scrapy is the most effective and popular choice for web scraping and is used in many areas such as data science, journalism, business intelligence, web development, etc.

This workshop will provide an overview of Scrapy, starting from the fundamentals and working through each new topic with hands-on examples.

Participants will come away with a good understanding of Scrapy, the principles behind its design, and how to apply the best practices encouraged by Scrapy to any scraping task.

Goals:

- Set up a python environment.
- Learn basic concepts of the Scrapy framework."
,Open Space,09-19-2015,16:30,17:00,LaterPay Learning Space (Bistro),,
,Getting started with testing scientific programs part 2,09-19-2015,16:30,18:00,The Software Sustainability Institute Room (CC2.1),,"Martin Jones

When writing programs for scientific research, we tend to be focussed on getting results, so testing is generally not a priority. Often, this means that our data-processing pipelines end up incorporating programs that don't have test suites. Examples of high-profile retractions due to software errors (e.g. http://www.sciencemag.org/content/314/5807/1856.full) illustrate the dangers of this approach. 

This session will be a gentle introduction to testing, aimed at people writing scientific software who would like to start taking advantage of automated testing. We'll start with Python’s built-in tools and moving on to using the Nose testing framework. We’ll look at the problems that testing can solve, and see some best-practises for writing tests.

####Goals

The goal of this training session is for attendees to come away with (1) an understanding of some basic testing concepts, (2) some hands-on experience of running tests and interpreting the output, and (3) an idea of how to start applying these tools to their own projects.

####Who should attend this session
Attendees should have a basic knowledge of Python and should be familiar with the idea of functions, conditions and exceptions. They should also have the Nose package installed (pip install nose should work in most cases).

####What to do before this session
If you plan to attend this workshop, you can make things run smoothly by making sure that you have the `nose` module installed. Follow [the instructions on the nose website](https://nose.readthedocs.org/en/latest/). You'll also need internet access in order to download the example files, so make sure you can connect to the conference wifi."
,PyKids Organisers Tidy up,09-19-2015,16:30,18:00,Bank of America Education Track (Simulation Centre),,
,Dispelling py.test magic,09-19-2015,17:00,17:30,PythonAnywhere Room (CC1.3),,"Tomek Paczkowski

This short talk will look under the hood of how py.test uses assertion
statement rewriting to give users a better, more pythonic testing experience. 

Usually in Python, assertion statements are quite simple and tedious to work
with, where a simple snippet of code like this:

    def double(x):
        return x * 2
    expected = 5
    assert double(2) == expected

finishes with message that does not include any context:

    Traceback (most recent call last):
      File ""t.py"", line 5, in <module>
        assert double(2) == expected
    AssertionError

With py.test, we get a lot more information with all intermittent values nicely
described:

    t.py:5: in <module>
        assert double(2) == expected
    E   assert 4 == 5
    E    +  where 4 = <function double at 0x1033add08>(2)

During this talk you will learn about all the ingredients needed to
reverse-engineer py.test behaviour, using import hooks described in PEP 302,
and the ast module from standard library. We will try to use these hidden gems
in a broader context, outside of testing."
,Chromebooks in education - the next five years,09-19-2015,17:00,17:30,Osper Room (CC1.4),,"Jonathan Fine

North American schools will, in 2015, buy 3.6 million chromebooks, out of global sales of 7.3 million (and 8 million predicted for 2016).  In this market they are outselling iPads and will soon challenge Microsoft.  Perhaps Europe will follow.

This talk will give a social, economic and technical survey of chromebooks, looking ahead to the next five years.  A major problem is using chromebooks as a platform for learning Python. This is because, like iPhones, they are locked down (except that they support a 'developer mode' that allows your own version of Linux to be run as a guest operating system).

This year I replaced my laptop with a chromebook."
,PSF Reception,09-19-2015,17:00,18:00,LaterPay Learning Space (Bistro),,
,PyCon Namibia,09-19-2015,17:30,18:00,PythonAnywhere Room (CC1.3),,
,The Fabric that holds the cloud together,09-19-2015,17:30,18:00,Osper Room (CC1.4),,"Konstantin Benz

What's this session about?
Fabric is a Python library that offers a simple API to manage remote connections to distant servers and PCs via SSH protocol. Although it is a simple library, fabric is an extremely powerful tool for managing virtual machines in the cloud. Fabric can be used to login to virtual machines, upload files to them, install software packages on them or download files of them. Furthermore fabric can be extended to a fully-fledged (but still lightweight) configuration management tool. Fabric can be combined with the Python cuisine library and Python's ""native"" capabilities like serializing objects, writing data to JSON files and manipulating regular expressions. By employing this capabilities almost every VM administration task can be automated. VMs can be connected to each other, they can authenticate with each other and they can communicate to each other. In short: fabric is the ""glue"" that holds your VM environment together. If you're involved into DevOps, fabric is your tool to manage the cloud. You will get to know to do this in this session.

Overview
In this talk we will show you fabric's capability to manage and configure virtual machines in the popular Python-based cloud operating system OpenStack. Thereby we will show you how to do password-based and public key authentication with fabric, remote software installation with package managers, management of users and groups, management of file permissions, file uploads and downloads, configuration file manipulation with regular expressions (Python re module), serialization with pickle or JSON and manage communication between VMs. 

After this session you will know
* How to connect to OpenStack virtual machines via fabric API
* How to create private/public keypairs and authenticate to virtual machines
* How to combine fabric and cuisine to configure virtual machines
* How to use the Fabric API to employ package managers (like apt, yum, zypper, pacman) which install software packages on virtual machines
* How to add users and groups via Fabric to your virtual machines and set the right permissions to files and directories
* How to upload files to virtual machines or download files from virtual machines to your local computer
* How to use regular expressions and configuration file templates to create custom configuration files
* How to serialize objects with pickle or JSON and use serialization let VMs communicate to each other"
,X,09-19-2015,17:30,18:00,YPlan Room (CC1.8),,
,The Lightning Talk Show,09-19-2015,18:00,19:15,PythonAnywhere Room (CC1.3),,
,Break,09-19-2015,19:15,19:30,PythonAnywhere Room (CC1.3),,
,The PyCon UK Dinner (Ticket required),09-19-2015,19:30,23:59,PythonAnywhere Room (CC1.3),,
,Alt Party (TBA),09-19-2015,19:30,23:59,The Software Sustainability Institute Room (CC2.1),,
,Breakfast,09-20-2015,08:00,09:00,Cafeteria,,
,Opening Plenary,09-20-2015,09:00,09:15,PythonAnywhere Room (CC1.3),,
,Keynote: Naomi Ceder - Confessions of a True Impostor (A Survival Guide),09-20-2015,09:15,10:00,PythonAnywhere Room (CC1.3),,
,Simplicity Is A Feature,09-20-2015,10:00,10:30,PythonAnywhere Room (CC1.3),,"Cory Benfield

When you talk to software professionals, you come away with the idea that we have a case of feature-itis. An enormous number of people evaluate software in terms of the length of feature lists and functionality. People dismiss software with fewer features as “underpowered”. And how many times have you heard software devalued because “I could build that”?

And yet, intuitively we know that’s not always true. urllib3 has more features than requests, but people overwhelmingly prefer to use requests. Android has more features than iOS, but Android hasn’t demolished iOS.

The reason for this is that simplicity is a powerful advantage. This talk will explain what is meant by simplicity, how to judge software simplicity, and how to approach building simple tools. It’ll also talk about how to structure your code to give the optimum balance of simplicity and flexibility, to keep yourself and your users happy down the line."
