Don't change any of these headers!,Session Title,Date,Time Start,Time End,Room/Location,Schedule Track (Optional),Description (Optional)
,Registration / Breakfast,09-18-2015,08:00,09:30,Cafeteria,,
,Opening Plenary,09-18-2015,09:30,10:30,PythonAnywhere Room (CC1.3),,
,"Keynote: Van Lindberg, PSF Chair",09-18-2015,10:30,11:30,PythonAnywhere Room (CC1.3),,
,DjangoGirls,09-18-2015,10:30,12:00,Training and Hackathon (Simulation Centre),,
,Trans*Code,09-18-2015,10:30,12:30,Training and Hackathon (Simulation Centre),,
,Minecraft in Education,09-18-2015,10:30,11:20,Bank of America Education Track (Simulation Centre),,
,First steps in Python,09-18-2015,10:30,11:20,Bank of America Education Track (Simulation Centre),,
,Skycademy,09-18-2015,11:20,12:10,Bank of America Education Track (Simulation Centre),,
,PyGame Zero,09-18-2015,11:20,12:10,Bank of America Education Track (Simulation Centre),,
,Python's Infamous GIL,09-18-2015,11:30,12:00,PythonAnywhere Room (CC1.3),,"Larry Hastings

You’ve heard about Python’s GIL. But what is it really? What does it do, both good and bad?

Come learn all about the Python GIL. You’ll learn about its history, all the problems it solves, all the problems it causes (that we know about!), and what it would take to remove the GIL.

Attendees should be familiar with the terrors inherent in multithreaded programming, and be comfortable with a little C code in the slides."
,A deep dive into python import hooks,09-18-2015,11:30,12:00,Osper Room (CC1.4),,"Louis Taylor

In this session we will introduce python import hooks and all the fun that can be had with them. Find out how to completely customise import logic and import modules from any location and any type of file."
,Introduction to Python,09-18-2015,11:30,13:00,YPlan Room (CC1.8),,
,"Real-Time Data + Django = Fun,Growth + Profit",09-18-2015,11:30,12:00,LaterPay Room (CC2.1),,"Rachel Willmer

I've been trying for 2 years to find a good [*] solution for how to add real-time wow into my ebook search site Luzme. Finally, I think I may have it; 

Python/Django meets AngularJS/Firebase; and Luzme finally gets real-time data updates without thrashing the database with repeated querying.

[*] ""Good"" = easy to implement + scalable + financially viable"
,PGP key signing party,09-18-2015,12:00,13:00,PythonAnywhere Room (CC1.3),,
,Career Clinic,09-18-2015,12:00,13:00,Osper Room (CC1.4),,
,Lunchtime Event,09-18-2015,12:00,13:00,LaterPay Room (CC2.1),,
,DjangoGirls Lunch,09-18-2015,12:00,12:30,Training and Hackathon (Simulation Centre),,
,Your code in space with AstroPi,09-18-2015,12:10,13:00,Bank of America Education Track (Simulation Centre),,
,Code Club,09-18-2015,12:10,13:00,Bank of America Education Track (Simulation Centre),,
,DjangoGirls,09-18-2015,12:30,18:00,Training and Hackathon (Simulation Centre),,
,Trans*Code Lunch,09-18-2015,12:30,13:00,Training and Hackathon (Simulation Centre),,
,Lunch time Event Spare Slot,09-18-2015,13:00,14:00,PythonAnywhere Room (CC1.3),,
,Lunchtime Event Spare Slot,09-18-2015,13:00,14:00,Osper Room (CC1.4),,
,Workshop Room Setup),09-18-2015,13:00,14:00,YPlan Room (CC1.8),,
,Lunchtime Event,09-18-2015,13:00,14:00,LaterPay Room (CC2.1),,
,Trans*Code,09-18-2015,13:00,18:00,Training and Hackathon (Simulation Centre),,
,Education Track Lunch,09-18-2015,13:00,14:00,Bank of America Education Track (Simulation Centre),,
,Keynote: Daniele Procida All I really want is power,09-18-2015,14:00,15:00,PythonAnywhere Room (CC1.3),,"Daniele Procida

Computing power is a kind of power, but I’m interested in a more powerful power: power over other people.

I want to understand power and where it comes from. I’m curious about the balances and imbalances of power in our worlds of software development, how it moves around and where it goes. I want to know how it affects the people who have it, how they use it, and whether they even realise that they hold it.

I believe that it really matters to open-source communities, that it’s poorly understood, and that not understanding it has harmful consequences for us."
,"All hands resource generation un-conference, adopt a developer",09-18-2015,14:00,16:00,Bank of America Education Track (Simulation Centre),,
,Analyzing Python with Pylint,09-18-2015,15:00,15:30,PythonAnywhere Room (CC1.3),,"Claudiu Popa

Given the dynamic nature of Python, some bugs tend to creep in our codebases. Innocents NameErrors or hard-to-find bugs with variables used in a closure, but defined in a loop, they all stand no chance in front of Pylint (http://pylint.org/).

In this talk, I’ll present one of the oldest static analysis tools for Python, with emphasis on what it can do to understand your Python code. Pylint is both a style checker, enforcing PEP 8 rules, as well as a code checker in the vein of pyflakes and pychecker, but its true power isn’t always obvious in the eye of beholder, especially when it's hidden through its verbosity. Interpreting its results can be a daunting task, but there are tricks which can be used to improve its user experience, such as enabling only structural checking with the -E flag or disabling unwanted category checks.

Pylint can detect simple bugs such as unused variables and imports, but it can also detect more complicated cases such as invalid arguments passed to functions, it understands the method resolution order of your classes, generators, contexts managers and what special methods aren’t implemented correctly.

Starting from abstract syntax trees, we’ll go through its inference engine and we’ll see how Pylint understands the logical flow of your program and what sort of type hinting techniques are used to improve its inference, including PEP 484 type hints. Pylint's roadmap includes better understanding of Python code, by improving its flow control analysis, escape analysis, understanding metaclasses and descriptors and having a better type checker, as well as improving the user experience, by reducing the number of false positives it currently has. As a bonus, I’ll show how it can be used to help you port your long-forgotten library to Python 3, using its new –py3k mode, which emits warnings regarding Python 3 compatibility.

The participants should have a basic understanding of Python. No other prerequisite is necessary, since the other concepts will be explained during the talk.

The following concepts will be explained during this talk:

  -   abstract syntax trees
   -  static analysis and why using static analysis for your code
   -  what is inference and what forms an inference engine"
,Choosing a web framework for Python 3 and asyncio,09-18-2015,15:00,15:30,Osper Room (CC1.4),,"Dan Clark

I left PyconUK 2014 with a feeling that I couldn't look myself in the mirror for too much longer without upgrading at least one of my projects to python 3. Yet I was happy with my flask+gevent+websockets stack and the lack of a clear migration path to python 3 was putting me off.

In this talk, I'll cover some of the challenges that came with selecting aiohttp, a relatively young/small/clean framework built on asyncio, like login and user registration, things we take for granted when using a more mature framework like django, flask or pyramid."
,Django Security Workshop,09-18-2015,15:00,18:30,YPlan Room (CC1.8),,"Peter Inglesby

This workshop will explore some of the ways that Django helps you keep your applications and your users secure.

We'll do this by taking a simplish Django site, disabling some of Django's built-in protections, and looking at how to exploit the weaknesses that become exposed.

Along the way, we'll look at types of attack including session hijacking, cross site scripting, cross site request forgery, and SQL injection.

This workshop is not a comprehensive ""HOW TO"" guide for keeping a Django site secure.

Instead, its goal is to help you understand the mentality required to both evaluate the kinds of security risks that web applications are exposed to, and protect against those risks."
,Deploy a flask application in a single step,09-18-2015,15:00,15:30,LaterPay Room (CC2.1),,"Colin Moore-Hill

It is intended that the viewer will understand basics of cdeating a dev env and show it going live.
To go from nothing to a deployed flask application with neo4j database in one step using docker-create to heroku.

Might also include docker machine and swarm."
,Understanding PyPy,09-18-2015,15:30,16:00,PythonAnywhere Room (CC1.3),,"Francisco Fernández Castaño

PyPy is an alternative implementation of CPython implemented in Python, to newcomers understanding concepts like RPython, JIT, PyPy garbage collection and other core concepts could be difficult so this talk is aimed to introduce all of these concepts and understand better how PyPy works."
,Leadership of Technical Teams,09-18-2015,15:30,16:00,Osper Room (CC1.4),,"Owen Campbell

Over the years, I've led, and been a member of, numerous technical teams on a wide variety of projects. Based on that experience, this talk will describe my observations on the role of the leader in that sort of team.

The talk will be in 5 sections:

* Introduction - A bit about my background so you can judge whether to bother staying for the rest.
* Authority - Where it comes from and the challenges you might face depending on the answer.
* Priorities - What should you be focussing upon?
* Style - There are many leadership styles, but what's yours and what's appropriate for technical teams?
* Process - What's your role in defining and managing process?

The slides for this talk are available from my website: http://www.owencampbell.me.uk/docs/pyconuk2015.pdf

They were prepared using LaTeX and the code is available at Github: https://github.com/meatballs/pyconuk2015"
,Gabbi - Declarative HTTP Testing,09-18-2015,15:30,16:00,LaterPay Room (CC2.1),,"[Chris](https://tank.peermore.com/tanks/cdent) [Dent](https://twitter.com/anticdent)

[Gabbi](http://cdent.github.io/gabbi/) is a Python-based tool for
testing web APIs using an easy to write and read YAML format that allows
tests to focus on HTTP requests and responses, not Python. It was
developed to make it easier to learn and contribute to OpenStack APIs
but can be used in any environment, even for testing services that don't
use Python (if that's your thing).

The presentation will give an overview of why Gabbi exists and a live
demonstration of its features. Listeners will hopefully go home with a
new and useful tool and an expanded perspective on ways to make tests
for web APIs.

For a taste of what the presentation will provide see
[these slides](http://redhat.slides.com/chdent/gabbi?token=EE3TApJU)
which were used to give a similar talk at the OpenStack Liberty Summit.
This talk will be an updated version including new features and learnings
from use in the field."
,PyPy for mediocre programmers,09-18-2015,16:00,16:30,PythonAnywhere Room (CC1.3),,"Ronan Lamy

This is a talk for mediocre Python programmers by a mediocre programmer. PyPy is an alternative implementation of Python. It is notorious for being fast, but also for using clever algorithms pertaining to advanced concepts such as type inference, garbage collection, just-in-time compilation, etc. So, can we, mediocre programmers, realistically use PyPy?

Yes, absolutely. In fact, PyPy developers did all that hard work so that we wouldn't have to. As we'll see, it runs most Python code exactly like CPython does, save that it magically makes it faster.

Porting existing applications is always more involved than running a simple script, so we'll also examine likely difficulties such as code relying on CPython implementation details, and dependencies on C extensions, and explore simple principles to let PyPy run your code even faster.

Finally, we'll have a glimpse of the future by looking at what's brewing in the PyPy lair, such as software transactional memory, new speed optimisations, better support for Python 3 and NumPy, ..."
,Elephant taming for snake lovers,09-18-2015,16:00,16:30,Osper Room (CC1.4),,"[Wes Mason](https://twitter.com/1stvamp)

PHP is one of the most popular web development platforms in the world.
Like it or not you can't argue with the widespread usage and popularity of PHP, from CMSs, to forums, eCommerce sites and more, there's a lot of actively developed/used code out there. 

Follow along with me as I attempt to explain the most appealing features, similarities, galloping differences between PHP and Python, and why you should care:

* Similarities (generators, traits, functional, modules).
* Managing dependencies and distributing packages with Composer.
* Debugging locally and remotely with XDebug.
* Pick a framework, really, any framework.
* Deploying apps with mod_php and php-fpm (We don't need no WSGI here).
* Documentation, sometimes *global everything* has good consequences.
* Migrating between versions, alternative implementations (from HHVM to HippyVM) and the future(s) of PHP, 7 and Hack."
,Making code py2/3 compatible using python-future,09-18-2015,16:00,16:30,LaterPay Room (CC2.1),,"Jørn Lomax

The talk will demonstrate how to port a Python2 project to python3. We will look at both making the code python3 exclusive, and making it cross compatible. This will be demonstrated using the python-future package, which is a camptibility library to aid with code porting. After this talk, you should be able to handle porting any python existing Py2 code to work with Py3.

This talk is based on work done during summer where the buildbot project was ported from Py2, to be cross compatible with Py3. It will demonstrate some of the challenges encountered and and some of the lessones learned during the process of porting both a small project (buildslave) and a large project (buildbot)"
,TeachMeet,09-18-2015,16:00,18:00,Bank of America Education Track (Simulation Centre),,
,Making Python Computations Fast,09-18-2015,16:30,17:00,PythonAnywhere Room (CC1.3),,"Russel Winder

Python is slow at computing things. Some people try to use Cython, Numba or even NumPy to get round this. However the best way forward is to use a specialist native code language. No not C. Some people will use C++, but the real cogniscenti will use D or Chapel. This session will show how to do this using a small example."
,"Templating - Past, Present and Future",09-18-2015,16:30,17:00,Osper Room (CC1.4),,"Ed Singleton

A summary of templating, with a look at older templating systems that have fallen by the wayside, the current choices for templating, and what the future of templating might be like, including what other languages are doing and whether we can learn anything from them.

There will naturally be bit of a focus on web programming, though we will definitely be looking at other uses of templating.

There will be some analysis of different styles of templating, looking at brevity, readability and power.

If anyone wants a templating system to be discussed, do feel free to let me know ahead of time."
,Instrument Your Python App with Metric Collection,09-18-2015,16:30,17:00,LaterPay Room (CC2.1),,"Marek Mroz

Brief Description
-----
Metrics gathering and visualization is a standard practice for systems and operations engineers. While not as commonly used in the data science world, metric collection tools and techniques can be useful for scientific computing projects. In this talk I will show how to instrument an application to collect metrics, and create a dashboard view to monitor and explore the collected data.


Detailed description
-----
InfluxDB is an open-source distributed time series database that is easy to set up and to get started with. Grafana is a dashboarding tool that works with InfluxDB and other time series back-ends. In this talk I will use a practical example to present how to integrate a Python application with InfluxDB, explore the visualization capabilities that Grafana brings to the table, and show practical examples of insights that can be gained from instrumenting Python applications with metric collection.

""Log everything"" is a great piece of advice for any project, whether doing exploratory research or deploying a system to production. Logs are invaluable for debugging and investigating specific issues. However, individual logs are only snapshots of application runs in time, and as the project grows and begins to incorporate multiple services, data processing pipelines, and compute resources, the value that can be immediately derived from bare logs diminishes. Logs also tend to be wordy, and the more you log, the harder it is to find the relevant information.

Traditionally time series databases were used to collect system metrics, but they can be equally useful in gathering application specific metrics. Logs can be complemented by metric gathering tools, which collect the data that you care about and expose it in an easy to query and to present manner. In conjunction with intuitive visualization and dashboarding provided by Grafana, InfluxDB can give great insight into inner workings of a system, and bring together all the disparate information into an interface that makes metric data exploration convenient. The two tools can help analyze performance bottlenecks, algorithm deficiencies, and resource constraints."
,Document all the things,09-18-2015,17:00,17:30,PythonAnywhere Room (CC1.3),,"Kristian Glass

Producing good documentation is a bit like flossing.
We all know we should, but somehow we never quite do.

Why do we find it so hard? What can we do about it? Why does it even matter? How can we get better?

Whatever you're doing, whatever your background, these questions matter."
,Python for mobile games on iOS and Android,09-18-2015,17:00,17:30,Osper Room (CC1.4),,"Safe Hammad & Fiona Burrows

Have you ever wanted to write a game in Python but wished you could run it on your phone? At Arctic Shores we're doing just that and even have a couple of games in production on both Apple's AppStore and Google Play.

In this talk we'll guide you through the tools we use to target, build and deploy to iOS and Android, including Kivy, Kivy for iOS and Myrmidon, our open source pure-Python framework for rapid game development. We'll also share with you the choices we've made and some of the pain we've felt getting one codebase to run on multiple platforms.

We'll then roll our sleeves up and demonstrate Myrmidon and its unique way of easily allowing complex object interaction and behaviour. We'll also discuss its modular nature and how that enabled us to deploy native apps to iOS and Android.

Finally we'll discuss our plans for the future of Myrmidon and how you can get involved."
,Resilient data pipelines using Docker-Compose,09-18-2015,17:00,17:30,LaterPay Room (CC2.1),,"Heeren Sharma

I have had experience of developing data piplines in Python based on huge volumes of unstructured events, processing them and storing them in NoSQL solutions like Redis both for fun and profit . Developing and Deploying aggresievely while maintaining the uptime of the system and it's various components was a key metric.
Learning from mistakes and failures, I wish to share my story of how docker made my and can make your life easy and sane.
With advent of docker, bridge between development and deployment has been wonderfully shortened. This talk will be centered around orchestrating different docker containers using docker-compose and how it facilitates the designing of whole system architecture by taking use case of a data pipeline. After giving the first overview of the docker-compose, my experience of developing data pipeline will be shared. 
And in the end, a short live demo (hack session - designing and development) will be presented so as to grasp the concept of realizing this whole approach and take away hopefully to your production systems."
,Python Projects on the Raspberry Pi,09-18-2015,17:30,18:00,PythonAnywhere Room (CC1.3),,"Ben Nuttall

Python is the most popular language in the Raspberry Pi
community. Also with the Raspberry Pi, it's easy to do physical
computing directly from Python code - rather than usual embedded
hardware engineering in C or Assembler.

In this talk I’ll show examples of computing projects that use Python
on the Raspberry Pi and demonstrate the sort of code used in such
projects.

This will be an informative session with learning possibilities to
give those new to Python on the Raspberry Pi a chance to get started.

Ben Nuttall is the Education Developer Advocate at the Raspberry Pi
Foundation in Cambridge, UK."
,Testing and Async - a journey,09-18-2015,17:30,18:00,Osper Room (CC1.4),,"James Broadhead

Testing asynchronous code can require different approaches to writing tests, and learning to write good tests can inform the architecture of your codebase. 
This talk will describe the evolution of testing in the TweetDeck API, a Twisted Python web api, and discuss some approaches to extending test coverage over a large legacy codebase. 
Examples will be in Twisted, but will be intended to be relevant to anyone working with established codebases or working with async in particular."
,Accelerate and scale your tests with nodepool,09-18-2015,17:30,18:00,LaterPay Room (CC2.1),,"Yolanda Robla Mota

I will describe Nodepool, the Openstack Infra tool used to spin up virtual machines for testing,
according to the realtime demand for tests.

I will explain how to setup it, and how to integrate with Gearman and Jenkins, to allow to run
tests on real-time and scaling that automatically.

Link to project source code:
https://github.com/yrobla/nodepool_job_launcher
https://github.com/openstack-infra/nodepool

Additional OpenStack Infra documentation:
http://docs.openstack.org/infra/system-config/nodepool.html"
,Using logical flaws to steal and modify business critical data,09-18-2015,18:00,18:30,PythonAnywhere Room (CC1.3),,"Frans Rosén

Independently of what type of programming language you work with, business flaws that could expose unauthorized data will always be hard to mitigate. Depending on the business, an issue for one company could in fact be a feature for another. Frans Rosén, a notorious white hat hacker, will explain how to find and test for these kind of business critical issues with examples from real life, such as Twitter, Facebook and Yahoo."
,Enabling the Optimisation of Python,09-18-2015,18:00,18:30,Osper Room (CC1.4),,"Stefan Popa

Scripting languages such as PHP or Python have a crucial role in powering most of today’s Web or Cloud-based applications running in Datacenters worldwide. In order to maintain competitive advantage, the performance of Python language must be under constant scrutiny so that the best results are obtained. Enabling open source contributors to focus on the performance status of the contributed code can be achieved by automating some of the repetitive tasks. This presentation proposes a framework which aims to facilitate the monitoring process by automatically measuring the selected relevant benchmarks for the Python code base."
,Trade management in Python - a story of throughput,09-18-2015,18:00,18:30,LaterPay Room (CC2.1),,"Ciprian Miclaus

Python is used more and more in finance and in investment banking nowadays as the language and platform of choice to solve various problems that were previously solved in other languages: Java, C++ or VBA. 

This presentation offers a gentle introduction to the world of trading and investment banking, the kind of problems encountered and solved and how Python fits in the picture. While there are many use cases for using Python in investment banking, this story focuses on the trade management and trade capture use cases.

It decomposes the trade capture scenario and shows how throughput (measured generally in trades/second) can be measured and increased. It then goes to describe a real world custom solution based on multiprocessing in Python.

At the end of the presentation, the participants will hopefully gain an idea of what types of problems developers working for investment banks have to deal with on a day to day basis and how Python is put to good use to solve those problems."
,PyCon UK Diversity Reception,09-18-2015,18:00,19:30,Bistro,,
,Day Ends,09-18-2015,18:30,19:30,PythonAnywhere Room (CC1.3),,
,The Friday Night Charity Social in memory of John Pinner,09-18-2015,19:30,23:59,PythonAnywhere Room (CC1.3),,
,Registration / Breakfast,09-19-2015,08:00,09:00,Cafeteria,,
,Opening Plenary,09-19-2015,09:00,09:15,PythonAnywhere Room (CC1.3),,
,Keynote: Dr Simon Sheridan Landing on a comet: From planning to reality,09-19-2015,09:15,10:00,PythonAnywhere Room (CC1.3),,
,PyKids UK Setup,09-19-2015,09:15,09:30,Bank of America Education Track (Simulation Centre),,
,PyKids UK Opening,09-19-2015,09:30,10:00,Bank of America Education Track (Simulation Centre),,
,JSON and the daughters of Pelias,09-19-2015,10:00,10:30,PythonAnywhere Room (CC1.3),,"Zeth

The JSON Data Interchange Format is Internet Engineering Task Force
(IETF) standard RFC-7159. Since its release, many new draft internet
standards have been published including JSON Schema
(draft-zyp-json-schema-04), JSOND (draft-oskarsson-jsond-00), JSON
Pointer (RFC-6901), JSON-LD (W3C Recommendation), JSON Merge Patch
(RFC-7386), JSON-RPC and JSON Reference
(draft-pbryan-zyp-json-ref-03); while new Python object to JSON
serialisation techniques have been published such as jsonpickle.

In this session we will implement these JSON technologies using Python
and evaluate their individual usefulness but also discuss how these
proposals can and cannot be combined to make JSON powered Python
applications. Finally, we will look at a Python application that I
made using some of these technologies."
